{
  "name": "Bazzite",
  "productName": "Bazzite Installer",
  "exeName": "Bazzite-Installer",
  "tagline": "The next generation of Linux gaming — your Windows files come along.",
  "logoEmoji": "",
  "fontFamily": "DM Sans",
  "accent": "#8a2be2",
  "accentText": "#ffffff",
  "background": "#0f0f0f",
  "card": "#1c1c1c",
  "text": "#f0f0f0",
  "installVerb": "Install",
  "catalog": [
    "bazzite",
    "bazzite-deck"
  ],
  "defaultImage": "bazzite",
  "hideCustomImage": true,
  "preloadImage": true,
  "publisher": "Universal Blue",
  "fileDescription": "Bazzite Installer"
}
