{
  "name": "TunaOS",
  "tagline": "A fast, cloud-native desktop",
  "logoEmoji": "🐟",
  "version": "1.0.0",
  "accent": "#0066cc",
  "accentText": "#ffffff",
  "background": "#0a0a0f",
  "card": "#1a1a24",
  "text": "#e0e0e0",
  "installVerb": "Install",
  "productName": "wootc",
  "exeName": "wootc",
  "publisher": "TunaOS",
  "copyright": "",
  "fileDescription": "TunaOS installer",
  "websiteURL": "https://example.com",
  "supportURL": "https://example.com/help",
  "catalog": [
    "yellowfin",
    "bluefin"
  ],
  "defaultImage": "yellowfin",
  "hideCustomImage": false,
  "preloadImage": false,
  "fontFamily": "Segoe UI",
  "logoDataUri": "",
  "fontDataUri": "",
  "themeCss": ""
}
